18ec74ec29	කොපමණ කාලයක් පවතිනවා ද?
18ecae071a	එක් පිවිතුරු බිම් කඩක් අසල නැවතුණේ ය.
18ece0685c	මේ දෙදෙනාගේ ආදරය නතර වුණේ නැහැ.
18ed123dde	මතු කිරීමට කැමැත්තෙමි.
18ed235f2c	nursery rhymes
18ed906758	ඔවුහු පෙන්වා දෙති
18ee0f9cf4	අනාවරණය කෙරෙහිය.
18ee364a77	පසුවන බව නොරහසකි.
18ee68d845	මෙම වාහන ඔහු වෙනුවෙන්ම නිදහස් වේ
18eeb648d3	ක්‍රම ක්‍රමයෙන් නිර්මාණය වෙමින් තිබුණි‍.
18eec910af	අකමැත්ත නිසා මේකට මගේ
18eee26739	කොස්ගොඩ තවත් සුදු කැස්බෑවෙක්
18ef03eff4	උඹ පැත්තකට වෙලා හිටපන්
18ef9b58e4	මෙහි ධාවනය කළ නොහැක.
18f04adc4e	මොවුන් මුලා කරලා තියෙන්නේ.
18f13546f0	මේ පිළිබඳව අවසාන වශයෙන්
18f14d1c2a	ශ්‍රී ලංකාව සම්බන්ධයෙන් පවත්වන ජාත්‍යන්තර පරීක්ෂණයට
18f29807ce	අපොයි අහගෙන උප සිරැසි යෙදුවා කියන්නේ
18f2b20127	තැන්පත් වෙන්න උපකාර වෙන්න පුළුවන්.
18f2bf57f2	මගේ එකඟත්වයක් නොමැති බව
18f390f05e	මොවුන්ගේ විෂ ස්වසන පද්ධතියට බලපාන ක්‍රම
18f4008767	ඕගොල්ලන්ගේ ආගමේ?
18f4d14f5b	නින්දා කරන්න දෙන්න බෑ.
18f4f3ec3d	ඔබට මැණික් කියන නම යෙදුවෙ?
18f5464a69	තමන්ගේ අතීතයට යනවා.
18f5a09b86	සිල් මුලින්ම පිරිය යුත්තේ ඇයි?
18f5b2b67d	එංජිම ආපස්සට රත්මලාන දුම්රිය ස්ථානය කරා ගෙන ආවේය
18f5e1c449	මම රැස්වීම් ඇමැතීමට වඩා කළේ
18f6585b06	අවුරුද්දට කොච්චර මරණවද
18f76565a0	ඒත් මහා ලොකු දෙයක් නොකරපු
18f77bbf1a	මෙවන් මුග්ධ අදහස් වපුරා
18f87d9dd3	එහි ශ්‍රී ලංකා වාර්තාව
18f8a92ba1	බුදු සිරුරෙහි ඇට එසේ උණු වී වැටෙන්නට
18f8fc3502	අම්පාර මහා රෝහලේ අධ්‍යක්ෂ
18f9d4d52d	මැක්ස් ට මේ නිසා කරදර පටන් ගන්නේ
18fa21c105	ආධාරකයක් හැටියට අරගෙන
18fa3bce61	මෙම මූල ධර්ම තුනක් ධර්මයේ සඳහන් වේ.
18fab0ee63	මිහිඳු මහරහතන් වහන්සේ පෙළ දහම
18fb2500b0	එම මාර්ගයේ කොළඹ සිට විල්පත්තු හන්දියට දුර
18fbcfd805	වෙනත් දෙවි කෙනෙකු විසින් නොවේ.
18fc3b3060	මුල් පියවර තබන ලද්දේ නිකිණි පොහොය දවසේ ය.
18fda63c68	මාගේ ස්වාමී වු
18fecfb0c3	කරන්න යන්නත් එපා
18fee7aa48	ඒ සිරුරු සතු සහජ නර්තන වින්‍යාසය
18ff070339	සෞදි අරාබියේ මක්කම ලගින් පන්සලක් හදල දෙනවා කියල ?
18ff395be3	සුවපත් කිරීමටයි.
18ffca5a53	එමෙන්ම එම ඇඳුම අදින කාන්තාවන්
