76004f39bc	Olympic
76011c3a0f	එයාගේ මාර්ගයෙන් දැනගන්නවා
7601886699	රජුන්ගේ සියළු රාජාභරණ
7601b8ddf2	එවකට මෙක්සිකෝවේ දෙවැනි ආණ්ඩුකාර ධුරය හෙබවූ
7601f4a46b	මුළු මහත් මානව සමාජයම
76023e4081	එසේ අනාරක්ෂිත ජාලයක් හරහා නිකුත් කරන
7602bf3e60	1905 තරම් වූ වකවානුවක
76038c10ba	දඹුල්ල වැනි ආර්ථික මධ්‍යස්ථාන අසාර්ථක වී ඇත
7603b764a6	සාදය පටන් ගත්තාට පසු
7603d799e5	උඩරට පහතරට නැටුම් ආදියෙන් අලංකෘතව
76040f4124	ඔය කිව්වා යකුන් ගේ චාරිත්‍රයක් කියන එක පැහැදිලි වෙනවා
760472769c	එනම්, මෙහි කතා නායකයා
76052c016c	අර සුපිරි සිර මැදිරියට
76053086f0	හැත්තෑ තුන් වැනි වියේදී
76054a75be	දිගටම උපසිරැසි දාන්න
7605898089	නාගයකු සේ ය.
7605a346ba	සිංහලකම නිසා බිහි වූ දැනුමයි.
7605b34b41	ඔය පිං කතා දෙන්නම්
760637373f	එල කවි ටික
760643d711	පහළ හෙලන හැටිත් ගැන
7606bd1e72	ආරච්චි හා මැණිකේ විසින් පිළිගනු ලැබූහ.
7606f955d1	එවකට ජේ.ආර්
760749097b	එක දැන්වත් තේරුම් අරගෙන
76075cc42e	භාවනා ප්‍රගුණ කිරීම බව පැහැදිලි ය
760777a0f5	මතුවන ප්‍රශ්ණයක් පමණයි
760787b9a4	නංවා ගැනීමට එය සමත් වූයේ නැත
7607b8b712	මාගේ බළවත් කණගාටුව.
7607c9bbd8	තවත් නිවාසෙකුයි අතර
7607da08e4	හා තනතුරත් වැඩ කරන තැනත්
760833c140	පෙබරවාරිවනදා වූ නමුත්
7608fd8a3e	හොරු මිනීමරුවො ඉන්න බව
76090e92ad	එම ප්‍රතිලාභීන්වත් දන්නේ නැත
7609579eac	බලාගෙන යද්දි මම මාර සින්දුවක්නෙ
7609beb9cf	මේ අතර වාර්තා වේ.
760a51bad0	free films
760a5983b5	එක විතරයි
760b1764aa	තාමත් ලංකාවේ හෙදියන්ට
760b5f3f7f	ඔන්න සහන් අවස්ථාව ලැබුණා
760b8c1c34	හරි ඔය කියන දිවයින පත්තරේම
760bb374e1	භවයක් භවයක් ගානේ පස්සෙන් එන්නේ
760bd81c53	තව ක්‍රම තිබුණා කියලා.
760c2f8ac9	යමපල්ලෝ එම තිරිසතුන් බිම පෙරළා
760cff2813	ඒත් නැන්දලාගෙ නම් ඉදිරියට දාලා
760d380d2b	කොපියට මැච් වෙන්නෙ නෑනේ
760de778ae	ඇටයක්වත් හම්බවෙන්නේ නෑනේ
760e3fc6c2	මරණය පිළිබද බෞද්ධ මතය
760edd102f	පන ‍පොවන්නෙත් ඇයයි.
760f4f6fa7	ඉංග්‍රීසි දැනුමේ අඩු පාඩු තිබීම
7610b71ad1	තමන් ත්‍රිපිටකය පිළිගන්නෙත්
7610f4f3d8	කවර ධර්මයක් ද යන කරුණ පිළිබඳව
7612bc8c61	උරහිසෙන් පන්නා දැමීමයි.
7612ff7d02	පද පෙරළි කියලා.
76135b434c	නමුත් ඇමතියා
761374af29	එම ලිපි එවීමට ඔහු යොදා ගත්තේ
76137a7ce3	පෑලියගොඩ ‍පොලීසියට පැමිණිලි කර තිබේ.
7613ca4be9	ආයි ආයි කොටන්නැතුව.
761411b3c2	ඒත් අකිල
761478a6ca	මේ කර්මාන්තයේ වැදගත්ම කොටස.
7614e3bc90	එම පින් අනුමෝදන් වූ ඥාති ප්‍රේතයන්
761569400c	එහිදී උදය විසින්
7615aef7c7	ඔන්න ගොයියෝ කෝරළේ මහත්තය
76161474cb	එහිදී වැදි රජුගේ ප්‍රවිශ්ටය
7616727f33	සමාජ පරතරයක්
7616d82f46	අපිට ලංකාවේ එවැනි රංගශාලාවකට
7617299560	සෑම්ටයි ඩීන්ටයි දැනගන්න ලැබෙන්නේ.
7617a0030b	චිත්තාකර්ශනීය මානව රූපයක් බවට
76180572dd	ඉඩමක පොල් ගස් කිහිපයක් තිබී ඇත
76192a7ac9	එදා ලෙහෙනි පැටියා මහමුහුදට ගසාගෙන ගියකල්හි
761994536d	අනික දයාසිරියමොන උනත්
7619c04014	metal detectors videos
7619e7214c	ඉතිං දරුව ලොකු වෙද්දිත් මේ තාත්තා කොච්චර හොඳ මනුස්සයෙක් උනත්
761a38cc6d	පිළිගැනීමට හෝ
761a95b9f8	මෙහිදී අප සැලකිල්ලට ගත යුත්තේ
761aa8dd39	සමන්මල් අටමිටක් පුදා
761b1fda16	නිවැරදි කිරීමට කැමැත්තෙමි
761c3544c3	උඹ කොහොමද
761deff7ac	එම මරණයේ
761e0b1569	එක එක්කෙනා එක එක විදිහට මේ නගරෙට ලඟා වෙනවා
761e4a340b	herbal plant of asia
761e7bf165	නමුත් එතනදී
761e976b4c	මේ භද්දිය හාමුදුරුවන් බව පේනවා.
761f07d5a7	අපේ පරම ආයුෂ
761f3eb119	අප රටේ දැවෙන පාරිසරික ගැටලුවක්.
762033395e	මගෙන් සිද්ධිය පිළිබඳව විස්තර අසා අත්සනක් ගත්තා
7620746c4b	එහෙත් එය දැනුම් දීමක් පමණක් වූ බව
7620b57a35	ප්‍රඥාගෝචර නැ.
7620dc27bb	සතෙක් වුනානම් ආලෝකය කියා
76219a761d	ඇයි සුද්දෝ එක්ක කතා කර කර ඉද්දි
762214e3b1	කඳු තරණයට ගොස් ඇතැයි ද
76222480e7	ආදේශක මොනවත් ලංකාවෙ තිබුනෙ නෑ.
7622aab836	ඒත් සමහර මුස්‌ලිම් කාන්තාවන්
7622fdf6e5	සහෝ ජයවේවා තැන්ක්ස් මචං.
762352bb28	පවත්වන්නේ කිංස්බරි හෝටලයේදී.
76242b1cfa	අයිතිය පිලි ගනීද?
76246d01eb	එයට හේතුව ආණ්ඩුව
76248816aa	lanka videos
762496f6ea	අනුරාධපුරය වනයෙන් වැසී ගියේය.
76249b30fb	මෝස්තර නිරූපින ශිල්පිනියක් වෙන්න හිතාගෙන
7624e4d2e3	handmade handbags
76252d147a	ප්‍රවාහනය සඳහා මේ සතුන් යොදා ගැනේ.
76253fd7dc	අනෙක් පැත්තෙන් කල්පනා කළොත්
76257f60df	මහින්ද චින්තන වැඩපිළිවෙළ මගින්
76259a574e	අජිත් විසින් පිරිස රැගෙන යන්නේ සරණගේ ගෙදරටය
7625a9ec70	අන්න ඒකෙන් නම් ටිකක් දිනල තියනව
7625d93e0d	ස්පර්ශය කියල.
7625ee3b14	එහෙම වෙනස් වුනොත්
76263cfca0	මම මේ ප්‍රදේශයට ආවේ.
7626756a36	එම පුවත්පතේ පාලන කර්තෘ
7626a3b74d	බොහෝ දෙනා
7626a9b9e9	අපොයි බෑවට බලන්න වෙන්නේ නෑ
7626de3cca	දෙවි පිරිසක් ගැනත් සඳහන් වෙනවා.
7626fb4de8	සමනය වේ.
76274f1c28	හිතට දුකක් ආව ගමන්
76279e753f	මෙම දේශනයෙහි සඳහන්
76281cd465	අනතුරුව ඔහු රැකියාව ලෙස කළේ
76284f04eb	මොකද ඔතන තියෙන්නෙ
7628738751	එලෙස වියත් ජන පැසසුමට ලක් වන පිළිම
76289db947	පිළිමය නොසැලී සිටින සෞන්දර්ය ප්‍රාතිහාර්යක්.
7628b24021	මොකද රූපවාහිනියට මූණ දාගන්නවා කියලා නෑනෙ ඉඳලා හිටලාවත්.
7628d5eee7	එබැවින් නිර්භීත මාධ්‍යවේදීන් හට
7628e24a2e	මෙච්චර මේ රාජ්‍ය සේවය කරනවා
762922e9cb	එවන් අවජාතකයින් රැලක්
762992407b	එම කාන්තාවන් සියල්ලන්ටම අවශ්‍ය වී තිබුණේ
762a05f8f9	දරුණු විස සහිත සර්පයන්ට බිය වූයේ
762a957240	ස්තුතියිවත් නොකියන එකනම්
762ac4e57e	ඒවා ඊනියා බටහිර මානව හිමිකම් පඤ්ඤාවරුන්ගේ
762b8d1727	සියලු ජන කොට්ටාස වල තියෙන
762c67a75f	අනික මහළු වෙනකල් ඉඳලා
762c6ab6c3	වෙන්නට බැරිද?
762c8f2b07	හොඳ බබා වගේ
762c96f252	ගාමිණියි මාලිනියි ඇඳුම් පවා ඇඳලා ඉන්නෙ
762ca13a0e	මොකද එහෙම කලේ නැත්නම්
762cdc5c58	මෙවන් පුද්ගලයෙක් යොමු වනවා මෙහිම ඊළඟ අන්තයට.
762d6dc161	ඒ බටහිර රටවල පවතින
762d74ad8a	අපිට ධෛර්යයක් ගෙන දෙන බව
762da52ee5	කී දෙනෙක් නම් පාර හරහා යෑමේදි
762ebed710	විෂ්ණු කතරගම ආදී හින්දු දෙවියන් අදහති.
762f20b6bf	බලනව නම් මෙන්න බඩු.
762f3a01e7	ගමෙන් කැම්පස් ආපු ළමයි.
762fbabbb7	උසස් අයගේ ආධාර උපකාර ලබාගත හැකි දවසකි.
7630056e5b	වෙසක් මැයි පසළොස්වක පෝය දිනයේ සිට ය.
763007dd54	කේක් ගෙනියන්නේ නෑ.
76304d8d83	මේ ශාසනයෙහිම
763054529b	යම් සැකසහිත ස්ථානයක් පරික්ෂාවට ලක් කරනවා.
7630d4dda7	මම කැමැතියි නිළියක් කියනවට වඩා
7630de7069	එම නිසා පාසල්වලත්
76311a0559	මමත් කාලේ කෑවා තමයි
76312a6dbd	කමකට නැති ගූගල් පස්සෙ යන්නම ඕනද?
76324ed1c2	මොහු මූලික අධ්‍යාපනය ලබා ඇත්තේ
76331db9a3	අපි මාර බලවේගය පිළිබදව
7633ae2c85	උත්සාහ කළහ.
7633f778d5	ඒත් ඒගොල්ල කලේ
7633f859a4	එතකොට ඔය මම කියපු
763424779c	ඔය රිටිගල ජයසේන කියල
7634408177	හොර වැඩවලට මං කැමැති නෑ.
76344f7be2	ගම්පහ රත්නාවලී බාලිකා විද්‍යාලයේ විදුහල්පතිනිය
7634bc927b	මෙම සප්ත විශුද්ධි සම්පාදනයේදී
7634c29268	ඉඳිකිරීම් ද අතර මග නවතී
763540a5bc	ඇය දෙවියන් ගෙන්
763591ac49	පිට පෙනුම විතරක් අලංකාර භාජනයක් වගේ.
7636af9413	බීමතින් පෙළපාලියට පැමිණි ඔහුගේ ආධාරකරුවන්
76380a687e	උසස් ගෘහ නිර්මාණ ශිල්පයකට අනුව ඉදිකර තිබිණි
7638c6e551	ඇහැරිලා නිදි ගැට කැඩුවා
7638c8b44b	මේ කරන සේවය ඉහලින්ම අගය කරනවා.
7638f8dd19	ඒ පුහුණුව ලැබෙන්නෙ.
763937e957	කිසිවෙකුට වසාලිය නොහැකි ඤාණයක්
7639a8dbc9	එය මුළු මහත් සමාජයටම
7639d4e575	ඊට පස්සේ මම ඇහැව්වා
763a398872	සිය සගයන් දෙස බලා සිටියේය
763aa41d63	ජාතිවාදය තුලම ආරක්ෂක වෙනවා
763b118f12	එය බුදුරජාණන් වහන්සේගේ ප්‍රකාශයක් නොව
763b6d940b	බරණැස් රජුගේ අගමෙහෙසියගේ කුස තුළයි.
763b98ba1e	චතුරාර්ය සත්‍යය ගැන
763c2c58d3	මේ ආකාරයටම ශබ්දය රසය ආදි
763dbefd75	එසේ කරනුයේ
763e188b3d	උඹ දැන් පොර වගේ පෙන්වන්න කියන්නේ
763ed24bf0	නානායක්කාර දොස්තර මහතා කැදවීමට තීරණය කෙරිණ
763efac51c	එසේ ගොස් නැති පලියට
763f74e6aa	මුහුණ දෙමින් වන්දනාමාන සඳහා
763f92053b	ඒකට උදව් කරපු අසුරයොන්ට
763fadc307	ලෙස හඳුනා ගැනේ.
76401ffd6c	ඒවා ස්වර්ග වේ.
7640ce87b6	පූජනීය ලෙස සලකන ලෙසට
76414fcdd2	මිනිස් සිත් සතන් තුළ
764218093a	අඩුපාඩු සහිතවයි
764269efa0	රජතුමනි, එවැනි කාන්තාවකට පුතෙක් උපන්නේ නම්
764298907d	සිය ආශිර්වාදය ලබා දෙන්නේ.
7642ea2741	මේ පර්යේෂනයෙන් කරල තියෙන්නේ කියල.
76430ab9c6	ඉතිරි කර නොගත් දිළින්දකු බවය.
764330dfff	එය ඇත්තක් දැයි සොයා බලාගෙන
7643b58239	එන්න කියලා හැමොටම ආරධනා කරන ගමන්
7643e61b6b	ඔබේ මේ ලිපිය ඒ නිසා ඉතා ඉහලින් අගය කරනවා
7643e9a1da	මේ වගේ විස්තර ලියද්දි
76440b3428	මොහොතකට වත් හිතන්න එපා.
7644170787	නැවත තලවකැලේ පොලිසිය වෙත පැමිණ ඇත
7644217ec2	නැතිවෙලා ගිය එකයි විතරයි.
76449164ff	මේ කමෙන්ට් එක දාන්නේ.
7644ba2e0b	අනාගතය ගැන තියෙන බලා‍පොරොත්තුව කොයි වගේද?
76452dcb7b	එහෙයින් දරුවන්ගේ
7645e6d050	අන්තිමට මුළු ඉතිහාසෙම
7646163a56	මේ වන විට
76463420df	සිතන්නට වත් බැරි නිසා
76466c3833	ආදරේ කරන කෙනෙකුට දෙන්න කැමති මොන විදියේ තෑග්ගක්ද?
764672e4fb	මොකෝ සද්දයක් නැත්තෙ .?
7646c0bf71	එකතු කරගන්නට වූහ.
76472f9814	දැන හඳුනාගෙන, තමාට ගැලපෙන
7647983b5e	ගුවන් විදුලියෙ සිංහල සේවයෙ ගීතයක් ප්‍රචාරය වෙනවා
7647fc7a28	මම දන්න හඳුනන මන්ත්‍රීවරු.
764808109e	ගණින්නාන්සේලා කියන හින්දා නෙවෙයි.
7648a369f3	එහි ස්වභාවය තේරුම් ගෙන
7648dfecaa	දරුවන් ඉන්ද්‍රජාලික ලෝකවල අතරමං කරන්නේ නැහැ
7648e00113	full movies
7648e06783	ඉතා වැදගත් අධ්‍යනයක් වනවාට සැක නැහැ.
764921b641	දෙස් විදෙස් විද්‍යාඥයින් විසින් සිදුකර ඇති පර්යේෂණ ගණනාවක දී
7649b30fe2	මටම හිතා ගන්න බැරි උන නිසා
7649eb6d45	මේකෙ ඉන්නව කාන්ජී ලාල් මෙහෙතා කියල කෙනෙක්
7649f04bbe	ජීවත්වීමට නව වසරෙහි ආරම්භයේ
764aee61d5	දිවි මග සකස් කර ගැනුමට උත්සාහ වත්වන ලෙස
764b265027	ඔක්කොටම වගේ ජොබ් තියනවා
764b6408b0	ඉබ්බන්වල දෙසට.
764b82f635	මෝස්තර නිරූපන ශිල්පිනියක් කියනවටද?
764b856938	උරුම කරගත් සත්ත්වයන් වන බැවිනි.
764c6db414	එනිසා මේ උතුම් බුද්ධ දේශනා සුලභ වීම
764ca93bd7	ඊට ප්‍රධාන හේතුව වී ඇත්තේ
764cda9127	ගුණයහපත් කෙල්ලෙක් හොයාගන්න හරි අමාරුයි බං
764d2e0038	ඛනිජ සම්පත්වල අයිතිය
764d3c062f	බුද්ධ කාලයට වඩා
764de421df	ඊට වඩා අපරාධ කාරයෙකුගෙන් බේරගන්න
764e0a676b	නිවනට දුරස්ථයෝ ය.
764e653ce5	ඉදින් සබඳ වසන්තයේදී හමුවන ඇය
764ee6fdfa	අපි කියන කුණුහරප බොහෝ විට
764ee7fc13	කුමාරයාට මෙය මහා වධයක් වුණා.
764f8373e7	ඒකට කැමති නම්
764fa49bd3	අද දවසේ සිදුව ඇත්තේ
765001bc69	sinhala english dictionary
7650049901	මැනේජ්මන්ට් ඩයරි වලට මාරු උනේ
76509ee9e6	එම නිවන් මග ගමන් ගන්නා
765101a527	ජාතික නාමල් උයන පිළිබඳ
