7c001aa1b8	ඒකෙ තියෙන ජාති ඔක්කොම වගේ හෙව්වත්
7c0024c4b4	සිංහල උපසිරැසි එක්ක බලනව
7c0054c48a	උනන්දුව කොතෙක් ද යත්
7c00963ca7	ඉගෙන ගනිද්දි ලොකු අරමුණක් නොතිබුණත්
7c00e0ef3a	ඒත් ඒ සතියෙ දවස්වල හින්ද වෙන්නැති
7c01555ca6	ඔහුට නිවන්සුව පතනවා
7c01c76542	exchange rates
7c01d0f1e3	ඉස්සරහ දෙන්නගෙම ඔලු වල රතුපාට තොප්පි නැති බව
7c01d4c89a	මධ්‍යම රාත්‍රිය දක්වාම
7c01dbb7aa	දඩයමෙන් උකුස්සා උකුස්සාගෙන් මිනිසා
7c02f24d83	ඇයට පැවරී තිබුණේ එදින පැමිණෙන අමුත්තන්
7c0314d20f	කුමන කරුණක් අරභයා
7c031e602b	බුදුදහම එරෙහි වන්නේ
7c031ec746	එය විධිමත් වූවක් නොවන බවත්
7c0339322a	අමතරව ගුණධර්ම හා ධාර්මික දිවිපෙවතකට අවශ්‍ය කරුණු දැක්වුවද
7c0398b025	ඒත් අපේ ලොකු ලොක්කෝ
7c039eb1b9	කීයෙන් කී දෙනාද.
7c0464839f	පොඩි උන් කොහේ නිදාගන්නද
7c04a580f2	එනම් සිංහල ගායනයේත්, විශේෂයෙන්ම නැටුමේත්
7c04b61886	තේරුම් ගන්න බැරි ගොන් හරක්
7c04c75a32	එක්කෙනෙක්ගේ නම තමයි ලින්කන් බරොව්ස්
7c04f47db1	දීප්තිමත් යුග නයන
7c051438c3	රටේ සිද්ධ වෙන දේවල් රටට විවෘතව හෙළිදරව් කළා නම්
7c05adaf83	අද සමාජයේ බිහිවෙමින් සිටිති.
7c05f6c5d3	ඒත් අපි
7c061531ab	විරෝධතා සහ ආණ්ඩු පෙරැළි
7c07166c75	එදා ළමයි ඒ විදිහට ගෙවල්වලට
7c072eb298	එදාට වසර හතරකට පසු
7c075084a8	අපේ ගෙදරට දැන් ලොකු ජල ප්‍රශ්නයක්‌ ඇතිවෙලා
7c078ca148	පස්සෙ ආණ්ඩුව කියයි
7c0798a63e	එමෙන්ම වෛද්‍ය විද්‍යාව සඳහා
7c082681fe	ඇය ඒ බව පුෂ්පකුමාරට දැනුම් දීමෙන් පසු ඔහු ඊට තදින් විරුද්ධ වී ඇත.
7c0839279f	ඒත් බහුතරයක්
7c0843c40e	ඔය කියන්නේ අර හාමුදූරුවරු
7c08c30e30	යමුකෝ බලන්න
7c09571e9e	එය චිත්‍ර කලාවටත් මූර්ති කලාවටත් අදාළ වේ
7c09dd8caf	ඔය වගේ අස්රෆ් කාලෙක කිව්වා
7c0a1083d4	එළිපිටම කරන චෝදනාව
7c0a63ec24	අනිවාර්යෙන් සුදුසුකම්තියෙන කවුරු හරි ඉන්න ඕන.
7c0a68cd71	පාචීන රජතුමාගේ රාජගෘහය අයත් ස්ථානයේ බව
7c0a9b2d53	කරුණාකර වග බලා ගන්න.
7c0ac30789	ධර්මයෙන් හොඳ පිළිසරණක්
7c0b0d88ed	ඇය සැමියාට මතක් කර දුන්නාය.
7c0b0f4866	දඬුවම් විඳින කොට
7c0b599ebb	දැකගැනීමේ අදහස පෙරටු කොට ගෙනයි
7c0b7913b6	යොමු කළෙමු.
7c0c339b48	පිළිමය නොසැලී සිටින සෞන්දර්ය ප්‍රාතිහාර්යක්.
7c0cc93f74	මේ අභියෝගය ජයගැනීම පිණිස
7c0cea9272	එමෙන්ම අකුසල කර්මයන් කෙරෙහි
7c0d39b667	උතුමෙකි යනුවෙනි.
7c0e2048b6	කවිය පිළිබඳව නිදහසේ සංවාදයේ යෙදෙන්නට අපූරු තෝතැන්නක් බව පෙනුණි.
7c0e24f2a3	කොහොම වුනත් මේ කතාවෙන්
7c0e68a684	කිරි විහාරය නමින් හැඳින්වෙන
7c0e8666c5	අමුම අමු මෝඩකම් පිළිබඳ කතන්දර
7c0ec0069a	සමන් දේවාලය අදත් සැහැදැවතුන්ගේ
7c0f88eee1	මේකෙන් දෙන දෙයක් අරන්
7c0f89b58a	තාම බලන්න බැරි වුනා
7c0f9ad038	එනිසා අතීතයේ රජවරු ඇමතිවරු
7c1009e1c7	විශ්ලේෂණය කරන්න හිතුනෙ නෑනෙ.
7c10e1f31c	සිංහල උරුමය ගැන කතා කරන්න පුළුවන්.
7c10e847fa	ඕනෙ වුනා කියලා මම හිතන්නෙ නෑ.
7c10f7fbad	ඔහු නික්මී ඇත.
7c1105fe34	ඇගට දැනුනම් කතාව අන්න
7c11125870	වඳුරෙක් මරලා මොළය අමුවෙන් කනවා.
7c12121995	අපූරු දේශපාලන ප්‍රපංචයක්
7c12cf7499	බොහෝම ස්තූතියි!
7c1320e63b	දැකිය හැකි සත්ත්ව විශේෂයකි.
7c14cef821	හෝ වංශ කථා වල නොදැක්වේ.
7c1599f857	සාර්ථක ක්‍රමයක් කියල
7c15abcaa8	ඔහු ඒ බව කියා සිටියේ
7c15e8bd59	මැදින් පුර පසළොස්වක පෝය
7c161922bb	කාලා හොඳටෝම ඇති වුණා.
7c1681ab34	සතුරා පහර දුන්නේය
7c16a3600f	අපේ කෑම බීම ගැන
7c16bd5dc3	වාහනයක් ගෙන එන්නට යන අතරතුර
7c1757946f	එමනිසා උමතු වන එම මව
7c17628c48	මාකේස් ඔහුගේ ‍ලේඛන දිවිය
7c18281e87	ගර්භනී මවක් ආරක්ෂා කිරීම සඳහා
7c1871ca44	එසේකියූ නිසාය.
7c18723346	ඉස්කෝල පොත කියන්නෙත් ඒකම තමයි
7c18ea6c5e	අද අප දකින සමාජය තුල
7c19645b52	යමෙක් කයෙන් ප්‍රාණඝාත කරන්නෙ නැත්නම්
7c19912c8e	එහෙත් ඉන්පසු කාලයෙහි
7c19ef0331	ආත්ම යන තවත් නිත්‍ය සංකල්පයක්
7c1a88b81a	ගුරුත්වය යනුවෙන් සංකල්පයක් නොව
7c1ad8de38	එයාට ඕනා මිනිස්සුන්ව අවුස්සන්න
7c1afc7a52	හේතු ගණනාවක් පැවතිය හැකිය.
7c1b105824	විසින් බරපතල අපරාධ සිදු කරන ලදී.
7c1b2276c3	මේ හින්දු සම්ප්‍රදායට අනුව
7c1b50cd5f	කණ්ණාඩි පොළඟෙක් නෙවෙයි
7c1b9a2e3c	සෞභාග්‍යමත්
7c1c43751f	බුදුරජාණන් වහන්සේ වෙතට පැමිණියහ.
7c1c4b57fc	ඒක නිසා ඇමරිකාවේම ඉන්න දෙන්න කියලා
7c1c4c7418	ශ්‍රී ලංකාවටයි.
7c1ca09326	මම දිගටම මුදුව දාගෙන හිටියා.
7c1d31c6de	විභාග කළ කමිටුවේ ස්වාධීනත්වය
7c1dcf7138	ඒක වෙන්න ඇති
7c1e19fe28	යතා කාලයේ තතා අයුරින්
7c1e27b0a8	යටත් නූල නැත්නම්
7c1e42ecb6	හොඳ කලදවසක්‌ උදාවේවි.
7c1ed00bde	එවිට පත්තිනි දේවිය යහතින් එම
7c1f4f122c	ඒවයින් තුවාල ලැබූ අයට
7c1ff61d51	යුරෝපය ආසියාව සහ උතුරු ඇමෙරිකාව යන රටවල්
7c20401ac4	ඔබ බලු මස් නොකෑමට හේතුව
7c20d0a42d	කාන්තාවන් අතර ජනප්‍රිය වෙන්නට පටන් ගන්නේ
7c211daab1	එහෙම මුදල් වියදම් කරන්න බැරි නම්
7c21768136	ඔය චිත්‍රපට සමාගම් වල අය
7c21deba78	ඒකට පොලිසියෙන් උනත්
7c2210bf83	මහා වංශයට වැදගත් ස්ථානයක් හිමිවෙයි.
7c224cd217	වස්තුව ගෙවල් දොරවල් ඉඩ කඩම්.
7c2298d7dd	මෙමගින් නිරූපණය වේ.
7c22e90210	යුරෝපයට සහයෝගය දක්වන යුක්රේන රජය
7c2376c85f	computer ads india
7c241427d5	මොකුත් නොපෙනී ගියොත්
7c246ef57a	ගීතය හරිම රසවත් විදිහට ගායනා කරනවා
7c24f46991	themes magnificent
7c24f9244b	හරි මේ චිත්‍රපටයේ වෙන්නේ
7c25675d00	අපිව කපනවා යැයි පවසමින් එළියට පැමිණ
7c25e4094f	කවදත් අපි වගේ
7c26b0c6bf	මේ කොටස නරඹන්නම වෙයි.
7c26db2e0a	දුක නිරුද්ධ වී යන්නේ ය.
7c2706d7c8	එබැවින් මැලේ ජාතික නායකයන්
7c270db94b	එල්.ටී.ටී.ඊ. සංවිධානයට උදව් නොකළ නිසා
7c271714e3	පිරිවෙන් අධ්‍යාපනයෙන් තවත් ඉදිරියට ගොස්
7c274e0811	එබැවින් විහාරස්ථානයෙන් බැහැරට යන
7c2756e20e	මොකද එයාව මගේ අම්ම තාත්තා තරමට විශ්වාස කළා ඒකයි.
7c27801809	ලෙයින් කඳුලින් දහදියෙ මහන්සියෙන්.
7c27bc9a4f	අපි අහලා තියෙන්නේ
7c281ba3ff	කතාකරපන් හොඳේ නංගී.
7c282bb949	තරමක් අපට පාලනය කරන්නට අපහසුය.
7c283d463f	බෞද්ධයෙකුට අපහසු වේ ද?
7c285be759	ඔයා ඔයාට පුළුවන් දේ කරන්න
7c288833a5	වසර දහස් ගණනක් ජීවත් වූ යෝගීන් සිටි බවය
7c288c9d42	රහත් වූයේ සැප ඇත්තේ වේ.
7c28bd508c	ආගමික හා ජාතික ව්‍යාපාර විශාල ප්‍රමාණයක්
7c2979df02	කතාව වගේ වෙන්න බොහෝ දුරට
7c2ad9516e	සවි ශක්තියෙන් අනූන වීමත්
7c2b007970	මේකේ කතාව යන්නේ
7c2b768135	අද එය දක්නට නැත
7c2b9ad231	අපිට අමුතු උනත්
7c2bfed8db	ධර්මයෙහි බොහෝ තැන පැහැදිලි කෙරේ.
7c2c05c6c2	කඩාකප්පල් වෙන දේවල්
7c2c441b5b	නමුත් මෙයා බඩු ටික තියාගෙන ඉන්නවා
7c2c6931bd	රාත්‍රී මධ්‍යම යාමයේ හිටි හැටියේ
7c2cb44616	අසාර වූ අනිත්‍ය වූ පිළිකුල් වූ මේ ශරීරයට
7c2cdb1e91	විශාල සංවර්ධනයක් ඇතිකළා.
7c2d044ba7	ගිය සතියෙත් උන් වහන්සේ විතරයි.
7c2d52a291	මේ වනවිට
7c2d5cdbb5	බටහිර රටවල සමාන්‍ය පවූලක සමාජිකයන්
7c2d7f78e2	මෙයට වසරකට උඩදී කාල් මාක්ස් ලියූ
7c2ddeac43	රටේ මිනිස්සු කියපු නිසා එල්ලුවා කියල.
7c2dfcac29	අන්තිමට කොහේවත් නැති විප්ලවයක්
7c2e0dacf6	එදින රාත්‍රි
7c2ef3e0c5	සිතක හටගන්නා වෛරය මොනතරම් දුරක් යනවද!
7c2f2092bb	රජ්ජුරුවන්ගේ ආහාර වේලට සකස්කිරීමට
7c2f923ab1	එහි නොකියැවේ.
7c2fe9128f	එය එසේ වී දැයි අසන්නට
7c2ff82d8f	සිත කය වචනය මෙහෙයවා
7c30608e8b	ගොදුරු වන අවස්ථා උදාවෙනවා.
7c3093e5d8	music notes
7c31ad4808	උන්ගේ ආගම ඇදහුවට
7c3218d51d	පොහෝ දිනයේ සුදුවතින් සැරැසී
7c322a4b90	යකඩ පක්ෂියා වඩා ඉහලට පියෑඹුවේය
7c32344c51	මම යම් උත්සාහයක් ගත්තා.
7c32b1a9f4	තැනකට යනකොට මාධ්‍ය සෙට් එකටම කියනවා.
7c33271e1b	ඇත්ත
7c33500cf1	එහෙම මිනිහෙකුගේ ජීවිතයට
7c337dcce1	කියලා ප්‍රාර්තනා කරමු
7c338e5b65	මා උපන් රටට ගැරහූ
7c33c42dcd	මෙම කතා හා සිද්ධි වලින්
7c3405cd7b	ඉදිකරන ලද ශිව දේවාලයයි.
7c34e50072	ඉතින් මම තේරුම් ගත්තා
7c353ff9dd	එන මිනිස්සුන්ගෙන් සල්ලි අය කරන්නේ නෑ නේද?
7c355a83dc	සකස් වෙලා තියෙන්නේ.
7c3583fecb	ඊටත් වඩා දෙයක් කරන්න මට පුළුවන්
7c362a658a	jobs in kandy
7c3667b366	house plan sri lanka
7c3692686c	මෙම ප්‍රහාරය සිදු වී ඇතැයි
7c375fab33	මට ගෙවා ගන්න බැරි ගාණක්.
7c37685ebf	ඇසළ පසළොස්වක දවසේ
7c37e35e4d	ඇත්තටම මම ඒක පලකරලා ටිකකින් තමයි මතක් උනේ වරදක් උනු බව.
7c38106afe	මෙම කෙටි ලිපිය ප්‍රමාණවත් නොවේ.
7c3933a730	ආදායම් තත්ත්වය සතුටුදායකය
7c399e9830	මෙහෙය වීමේ හැකියාව ද
7c39c86585	අනිවා බාගෙන බලන්න
7c3a4ce30f	මූලික අධ්‍යාපනය
7c3a8c6c77	අදට සමු ගන්නවා
7c3afdee25	දුප්පත් පොහොසත් පරතරය වැඩිවෙමින් පවතින බව
7c3b948276	ක්‍රිස්තියානි ආගම ප්‍රචාරය කිරීමට
7c3bd18128	එයා ඒ වැඩේට පාවිච්චිකරලා තියෙන්නේ
7c3bed5eeb	ජනකලා කේන්ද්‍රයේ ඉදිකළ සත්වෝද්‍යාන
7c3c404850	මේ මානසික සුවය නිසා
7c3c68e947	පාශ්චාත් අස්වනු නාස්තිය
7c3cd589de	ජෛන දැනුම් ප්ද්ධතීන්
7c3d3acb99	එයින් නොනැවතුණ නාට්‍යකරුවා
7c3db01894	තැන්පත් කරමින් වදය
7c3e7f1da9	ඉන් සිදු වන්නේ ඔහුට අනවශ්‍ය ප්‍රචාරයක් ලැබීම පමණයි
7c3efe10b3	ඇයි අපිට බැරි
7c3f012993	හිමි කාලයකි.
7c3f166d96	අපි තවම පුංචි දුවලා දෙන්නෙක් කියලා
7c3f28787d	තාලානුරූපී සංවාද භාවිතය තුළ
7c3f4df10e	කියන දෙය කරන,
7c3f759f77	බලන්න හිතන් ඉන්න අයත්
7c3faae78a	පිරිහුන සිතකිනුයි.
7c41042475	උපසිරැසි දෙන්න.
7c41a702bf	ඒත් මේ ගඩොල් ගලටත්
7c41dbc31b	අපට කියා දුන් පරිදි
7c4239a748	නමුත් ඇය
7c4273d21a	ඔය ලාබාල හාමුදුරුවෝ පවා මරපු
7c42b0fcd8	සැබවින්ම මෙම භික්ෂුව අපරාධකරුවා නොව
7c42c3e476	ස්තූතියි ලංකාදීපයට.
7c432aa6a4	දක්ෂ වාණිජ චිත්‍රපට අධ්‍යක්ෂවරයෙක්.
7c4426e87a	හේ බුදුන්වහන්සේ හමුව මෙම අදහස් පළ කළේ ය.
7c44c31747	අවුලක් නැතිවෙයිද?
7c44dd1826	ඔවුන්ගෙන් දිස්වන්නේ තරමක කලබලකාරි බවකි.
7c4503604a	අතුරුදන් කරන එක
7c4503dfc4	ගින්දර සමානව බෙදලා හැඳි ගාලා දෙන්න තමයි.
7c4581a0d7	අපේ කට්ටිය මේක ගන්නෙ
7c4590ba73	අවශ්‍ය පියවර ගෙන තිබේ
7c45ad193f	සීමාව නොඉක්මවා
7c45bc3d73	අපව යම්කිසි දෙයකින් හසුරුවනවා කියලා
7c47f90a31	ස්වර්ණාලේපිත බුදුපිළිමය ද මෙහි දක්නට ලැබේ.
7c48055d35	විරුද්ධ පිළ කිසිදු ප්‍රහාරයක් එල්ල නොකොට
7c482619c9	ඒවා සෝලියස් මැන්දිස් කලාකරුවා විසින්
7c487d588b	අනුරාධපුර මිහින්ත‍ලේ මහා විද්‍යාලයට
7c48a63b82	අපේ රට කරලා මිනිස්සු දහස් ගානක් මැරිලා
7c48ee1494	කිසිවිටක මම කල්පනා නොකළෙමි.
7c4940a684	තෝ අඩුගානේ ලේ ටිකක්වත්
7c49435d09	භාර කරන අවස්ථා සුලභය.
7c49551118	සත්ව හිංසාවට විරුද්ධයි
7c4962ea8d	පුරාකෘත අකුසල කර්මයක් විපාක වශයෙන්
7c498ad211	මීට පෙර බුද්ධ ප්‍රතිමා නිර්මාණය වූයේ නැතැයි
7c49a77d08	ප්‍රධාන ආරාධිතයා ලෙස එක්වෙමින්ය.
7c49de8a18	අනිත් අයට ආදරේ කරනවා කියන්නේ
7c4a07d4f6	එබැවින් ඇය ඇදහූ ආගම
7c4a4d61fb	නරක කෙනෙක් බව
7c4aaf532d	උබල වගේ උන්ට යුරෝපේ රටකට යන්න බෑ
7c4be389a7	ඔය සින්දුවේ වෙන අදහසක්
7c4d17b59e	ඔබ වෙත ගෙන ඒමට
7c4d4c60d7	ශ්‍රී ලංකාවේ මහත් ආන්දෝලනයට තුඩු දුන් කාරණයක්.
7c4d6c8a1e	මුලින්ම ඒ රසය විඳල
7c4e7219fa	ගජ මිතුරුව විකල්ප
7c4ea02106	ඔන්න බෑවා!
7c4f2a8dfc	ඊයේ දහවල් වනතුරුත්
7c4f340cb4	ඔවුන් විසින් හඳුන්වනු ලැබුවා
7c4f90f665	එනම් යමක් පවතින අයුරින්
7c4fad25ca	අති බහුතරයක් අකමැති වුණා
7c511ad021	තැනක ධාන්‍ය ගොඩක් තිබෙනවා.
7c5159852f	ඊයේ බැරක් ඔබාමා කතාවක් පවත්වන අතරතුරේ
7c5170a7c1	අම්ම මුත්තා කාලෙවත් අහපු නැති
7c51ccf381	කටයුතු කරමු .
7c51fa64c4	මේ අනුව බෝධි සත්වයකු සතු ප්‍රමුඛ ගුණාංග දෙකකි
7c51fec6b6	රසායනික ද්‍රව්‍ය තමා
7c522e7a47	මෙයින් පැහැදිලි වන ප්‍රධාන කාරණය වන්නේ
7c52b29f52	නත්තල් සීයගෙ හිම යානය මගින්
7c52ee6eda	ඔවුන්ගේ අකුසල විපාකයට අනුව
7c545c45d9	අපි අවධානය යොමු කළේ
7c54e93691	උන් සමග ඇයි හොදයියක් නැත
7c555281d2	එතැන් පටන් මේ මනරම් මහ සෑය
7c5614d387	නිතර කොළඹ සිටියේ නැහැ.
7c563d8caf	නිර්මාණය හා රසිකයා වඩ වඩාත් සමීප වේ.
7c56bd688d	එළ එළ ජය වේවා!.
7c56d85662	ආරක්ෂණ නූල මහජනතාවට ව්‍යාජ මුදල් හඳුනාගත හැකි නෝට්ටුව තුළ අන්තර්ගත තවත් ආරක්ෂණයකි.
7c5789a458	තදින් අවවාද කරන්න
7c58568a57	දැන් අපේ කතාව පැත්තට හැරෙමු.
7c58b1f913	කිසිම තේරුමක් නෑති දෙයකි
7c590ff022	මහබෝසත්වරුන්ටම පමණි
7c5a0d51d2	ඔවුන් ලොකු ලොකු තුවක්කු රැගෙන එන්නේ
7c5b19ec4e	මොන කණ්ඩායම බලයට ආවත්.
7c5b1a4b83	භාෂාවන් ද උගන්වා ඇත.
7c5b1f5533	අර ජිප්සීස් සින්දුවේ තියෙන අවවාදයමයි.
7c5b5a367a	අද අපේ රටේ ගොඩක් අය පොත් කියවන් නෑ
7c5b6772c3	අගමැති මේ රටේ ආගමික සිද්ධස්ථාන වැඩියි
7c5c3fa426	උඹ ලියනකොට කොහොමද ලිව්වෙ කියල හිතල බලපන්
7c5cac3116	වැඩි දෙනාගේ කැමැත්තට ඉඩ දෙන්න කියලයි
7c5cd14dca	තැනැත්තාගේ සිත තමයි එතන බලවත් වෙන්නේ.
7c5d14d5d6	ආමඩිල්ලා පොළොව දිගේ හෙමින් හෙමින් ඇවිද යනවා මිස
7c5d409e3d	සෑප්තෑම්බර් මාසයෙ මගෙ යාලුවෙක්
7c5de2ecf3	ඒකට තමයි බුදුරජාණන් වහන්සේ වදාළේ
7c5fa05766	මේ ධනය මත්පැන් පානය සඳහා යොමුකළහොත්
7c5fb92069	සිංහල පොතේ නම නම්
7c5fc500bc	ඒක මිනිත්තුවෙන් ඉවර කරන්න පුළුවන් වැඩක්.
7c5fcff297	එමෙන්ම මෙම ස්ථානයට පැමිණී
7c5fe476dd	කොහේ ගිහින් උපදිනවාද කියා
7c5feba7f4	ලෝක පූජිත වීමට නියමිතය.
7c6102f424	ඉන්දියාව සමග පැවැති මතභේද
7c627d4e6b	ඔයා ගිහින් තියෙන්නෙ
7c63a7f891	මහාවිහාරික භික්‍ෂූන් පෙන්වා දුන්න ද
7c63eac30c	ආගමික කටයුතුවලට
7c641017e3	මගේ දුව තමයි
7c645bef90	අවසානයේ රැකියා වෙළදපොල තුල
7c65db6fbe	උළෙල ආරම්භ කෙරුණ
7c6686b218	පුවත්පත් කලාවේදීන් අසරණ වීමේ
7c6689b057	ඔහුගේ ක්‍රමයෙන් ගල් අගුරු නිපදවා ගැනීමට
7c67125b25	කළ යුතු ප්‍රතිකාර නොමැති නිසයි
7c675de15b	සේවය කර විශ්‍රාම ගත්තේ
7c67b7b9d8	ඔබට වාසනාවන්ත දිවියක්
7c6864c5e8	තැති ගැනීමක් කලබලයක් මොකුත් නෑ.
7c686b520c	ඇතිවන ප්‍රතිඵලය
7c6884822f	ජය වේවා සබ්‍ ‍එ‍ක‍ට
7c6892f251	මහත් වූ භෝග සම්පත් අත්පත් කරගනියි.
7c68b11cce	ඵල සමවතින් නැඟී සිටියේ,
7c68bdc8be	තිඹිරියාගමගෙ මකරන්දෙ අස්සෙ
7c68e2ba7f	ඔය වගේ මිළදී ගැනිමකදි නම්
7c694a4172	ඔබට පිනක් කරගන්න අවස්ථාවක්.
7c69c0c704	සෑම ආගමකින්ම මිනිසුන් හිංසාවට පත්කරන
7c6ce6522b	මේක පාලනය කරලා
7c6d185783	මැලි ගතිය අලසකම තියාගෙන
7c6d6e1070	අපි දකින්නෙමු.
7c6d7a9ef5	අරුණි නෝනාට තේරුණේ නැහැනෙ.
7c6e004ff5	හමුවීමෙන් ම අහුබුදු සූරීන් මගේ සිත් ඇද ගත්තේය.
7c6e12e9c5	එම කුහරය සම්බන්ධයෙන්
7c6e595108	පරිසරයෙහි සියුමැලි උපමා රූපකයන්ගෙන්
