0000f47c22	මහවැලි ගඟට ගොස් ආපසු එන ගමනේදී
d700b07f8c	යුද බිම ජය ගත් පාලකයා වන්නේ
d7010adbfa	වඩා තීරණාත්මක වුණේ
d70198f92a	අහල පහල මිනිස්සුන්ට වෙන වැඬක් නැතිවෙයි
d702b5aace	බොහෝ ඉදිරියට ගිය එකකි.
d702dc167a	ඊට අවසර ලබාදුන් මහාධිකරණ විනිසුරුවරයා
d703023bad	මේ කතාවේ කියවෙන උදුම්බරගිරි යනු දිඹුලාගල විය හැක
d7033ae466	එවිට ආයුෂ්මත් ආනන්දයන් වහන්සේට
d70400767c	හඳුන්වා දිය යුතු වෙනවා
d704106fb8	වඩ වඩා ඇලෙන ගැලෙන සෙනෙහසක්
d704146161	විහිළු කර කර කල්ගත කරනවා.
d70429965c	ත්‍රිපිටක ධර්මය පිළිබඳ උන්වහන්සේ ඉදිරිපත් කරඇති අර්ථකථන ද
d7046b7c5d	බලාපොරොත්තු විය නොහැකි ය.
d7051ed3c8	මනා සංවරයෙන් යුතු භික්ෂුන් වහන්සේ නමක් ලෙසයි
d705d7ddf6	මේ සියල්ලෙන්ම නිදහස් නේද?
d706905cf1	kids
d7070f3c2e	බලාපොරොත්තු සුන් වෙලා යනවා
d707124329	බං උඹනෙ ගල් ආඳා
d7076536e9	අවසානයේ ඔහුට සුපර්මැන් අයියගේ
d7078df72f	space
d707b7f525	සතුටක් ලබනවා.
d708144c93	ෆොන්සේකා කවදාහරි එජාපයට එයි කියලා.
d7093b611d	දන්දීම නිසා පිත කිපුනා වත්ද?
d70952f83e	ඔබ මෙන්ම මමත්
d709b9c5ad	කකා විරුද්ධ නිසා
d709f4fbee	සියලූ මාර්ග ජීප් වෑන් බස් රථ ධාවනයට සුදුසු තත්ත්වයෙන් පවතී
d70a207044	නත්තලට තොරණ ගහන්නෙ?
d70af10484	ඒක ගොන් කමක් ලෙස පේන්නේ
d70af2beca	මේක තනියම බලන්න
d70b280510	කීඩැවන්ගෙන් ගොයම් මැස්සන්ගෙන් හානි වන කොට
d70b70ef16	ගොවිපලක් කියන්නෙ
d70b86f82e	ආදරයෙන් කමෙන්ට් කලාට කමන් නෑ
d70bcea794	දකුණට හරවන ලද ජීප් රථය
d70bdfbc8e	අපි නිරන්තරයෙන් ධර්මානුධර්ම ප්‍රතිපත්තියෙහි
d70c2b2ad9	පාපකාරයාගේ හැටි එහෙමයි
d70c8a9ffa	පොජ්ජ ගැන කතා දමන්න.
d70cdd9fd7	ඉහළට නැග පරිපාකයට පත්ව
d70d3c0f52	ඒ වෙහෙස වටිනවා කියා සිතෙනවා.
d70d6b5015	ඒ කන්ටේනරය චෙක් නොකර නිදහස් කරන්න
d70e233778	අලි ගොඩබිම සිටින
d70e256ead	වඩා හොඳයි කියලා හිතුණා.
d70eccfdc5	ගොවිතැන්වලින්ද දේපොළවලින්ද
d710a9a715	ආණ්ඩුවෙ බැංකුවෙන් ණයක් දෙනවා.
d710cd202f	ගන්න කාලය වගේ හතර පස් ගුණයක් වෙලාවක්
d7114259fd	ඊට පස්සේ අපි දාන විසි තිස් වෙනි පපඩම්
d7122f92ef	ලොරිය පාර හරහා නතර වෙනවා.
d712374c44	ඉවත් වන ලෙස දැනුම් දී ඇති බව ද කියා සිටියේය.
d7137ff2e5	එහෙම මිනී මරන්න
d7138d92a7	උන් තමයි
d71454db49	ඉතා සුළු ප්‍රමාණයකි.
d71483f651	අධිකරණමය එකඟතාව අනුව ලබා දී
d714a1c480	මෙන්න මේ මසුරුකම මුල්කරගෙන
d714ca3c66	මුල් බුදු සමයට එකඟ ද යන්න ගැටලුවකි.
d714cf9b56	la bamba dance costume
d7167b9c9b	බලන්න මේල් එකක් යවල
d716d6bce7	එම සංඝයා අතර සිටි
d7175dccce	බෞද්ධ සමාජයේ ඒ මත තමයි
d717f34a8f	මේක හිංසනයක්
d71801441d	මේ අභියෝගය ජයගැනීම පිණිස
d71809c5a7	බෝධි පූජා කිරීම හා
d718a34122	ඉන්දගනීමටත් සවිමත් පුටු ඇත
d719c71972	අප එක් රැස් කර ගත යුතුයි.
d719e3ad5a	සුළු හෝ මධ්‍යම පරිමාණයේ ව්‍යාපාරිකයින්
d71a613c17	අයකරන මුදල
d71a6ba316	අගය කිරීමට ස්තුතියි
d71aa119f8	මෙවන් ජාතික නැකත් කෙළි පෙර සිට
d71b3349dc	සිව් රඟ සේනාවන්හි මුලින්ම ගියේ
d71b4a5cb7	එතකොට ඒප්‍රිල් රෝරි කියල කෙනෙක් එක්ක තනියම කතකරනවා
d71b626ee2	නිදන් හොරුන් විසින් විනාශ කර අවසන්.
d71b672cf3	බයිසිකලයේ සීනු නාදය බව
d71bb69e52	ගොඩනැගී ඇත්තේ
d71bf7b3b5	එම සිසිල් වාතය ශාලාව තුළ
d71c1521e4	ගම්පහ සණස ශාලාවේදී ඊයේ පැවැත්වුණි.
d71c3245fe	දුවපිය පොඩි එවුන්
d71c4e2f65	ඒක මම හරියටම.
d71d08cf06	කිසියම් ආකාරයක ප්‍රචණ්ඩ ක්‍රියාවන්
d71d87a98a	magazines scholastic
d71d8cbc69	ඔය වගේ
d71dafd881	මේවා බදාගෙන ඉන්න අය
d71e3468dc	ඒවා කියවීමෙන් පෙනී යයි.
d71f08b1e5	උඹ භාවනා කරන වෙලාවෙ ද
d71f59fbaa	අද ලාංකිකයන් ඉන්දියානුවන්ට වඩා
d71fdc765a	වැරදියි කියලයි මගෙ අදහස.
d71ff5133b	රසිකයින් මගෙන් අහන්නෙ
d720129808	අර හතළිහේ එක පනස් පහටදීලා
d720d17f82	බොරුව, කේලම, පරුෂ වචන, හිස් ප්‍රලාප මේවා අප්‍රිය ජනකයි.
d720e88077	එයාව සර්කස් කණ්ඩායමකට විකුණන්න.
d720f91284	අරි අටඟි මඟට අනුව
d721049c7e	ඒ කුසල් පමණි.
d721796ba9	මේ අවස්ථාවට සහභාගී වූහ.
d7217a4852	විඥාණවාදී දේශපාලනික ප්‍රවාහය රජ කරවීමයි
d7219430b7	මෙත්තා, කරුණා, මුදිතා, උපේක්‍ෂා යන සිව්බඹ විහරණ
d72220358e	අවම වනු ඇත.
d7222c60a0	මුන් ඉඩම් අල්ල ගන්න මාර ප්ලෑන් එකක් දෙන්නේ.
d722883186	මොකද එතනට හදිසියෙන්ම වගේ
d722b6c472	මෙතුමා අනාගාමී තත්වයට සිත දියුණු කළ ගිහි ශ්‍රාවකයෙක්.
d722e697ae	බුද්ධිමතා ඉක්මනින්ම
d723063cd7	මෙ‍යා ‍ග‍ම‍ට ‍ය‍න‍වා.
d723be2b0e	දරුවා සතුටු වනු දැකීමෙන්
d72456d3fa	ගොඩ බසින ඔහු තම යුද්ධය පටන් ගන්නවා
d7253afaa8	ඊට පස්සෙ මිනිහා තීරණය කළා
d7264f6c1f	ඓතිහාසික සත්‍ය කතාවක්
d72674e3e4	එය ඇසළ පෙරහර මිස
d7271e469e	තමා කොටින්ගෙ කරදරෙත් දිග්ගැස්සුනේ
d7271f9e41	ග්‍රැමි සම්මානයෙන් පුදනු ලැබිණ.
d72773f628	රැකියා සොය සොයා යන්නකු
d727957a2a	දස දහස් ගණන් නිවාස
d727cdf78d	සැදී පැහැදී සිටින
d72823896a	ආසියාවේ දැවැන්ත සංවර්ධන ව්‍යාපෘතියක්.
d728a1ae35	අප රටේ ළමා ප්‍රජාව ඉන්නේ ඉතාම දුර්වල මට්ටමකය.
d729647285	ඒත් මෙතෙන්ට පාත් වෙන
d729bb0366	ගෙදර ගිය ගමන්
d729e7546c	මෙහි ස්ථවිර නම්
d729ebb237	ඒත් පෙට්ටිය හොලවලා බලනකොට
d72a865c95	saranga
d72a879422	ඉකුත් සතියේ දිනක අලුයම කාලයේ
d72a88dc24	අවසන් මොහොතේදී
d72abb5564	ඉවුර දිගේ පල්ලමක් බැස කන්දක් නැගීම
d72aef961b	කාන්තාර දකින්න
d72af21d74	අත්සන් කලවුන්ට නොවැටහේ යයි සිතිය හැකිද?
d72b5d46b9	මේ මහපුරුෂ ලක්ෂණ තිස්දෙකම තිබෙන කෙනා
d72bd69c23	ඒත් මුහුණ නම්
d72bef16c3	දක්වා ඇත.
d72d95b7da	පරුෂ වචන.
d72e0ef449	ඒ ඉඩම් සඳහාක බද්දක් පැනවීම ගැනත්.
d72e717b7a	එය පිහිටි ස්ථානයේ
d72e829501	දෙවිවරු මුණ ගැසී
d72f8e7fdd	පොතුවිල් ප්‍රදේශයෙන් බව කියැවේ.
d72fad467f	අනිකුත් චෛතසිකවලට වඩා විශේෂ ශක්තියක් ඇති
d7302a7b58	අවුරුදු ගානකට පස්සේ දවසක් දෙකක්
d730a0adc1	නව සංස්කෘතික වටපිටාවක්
d7311ef2c6	hidden objects games for downloading
d731274644	ඒකට හේතුව නම් දන්නව ඇත්තෙ
d73150d55f	ස්ත්‍රියක විසින් සිය පුතුගේ
d731686a71	ඒත් මට මේ වෙලාවෙ
d7317bf58e	පහසුවෙන් ගොඩවෙන්න පුළුවන්.
d731b43a8d	අමුතු දෙයක් නෑහෑ.
d7326b0267	පහළට ගලනවා
d73299e54d	සිංදුව කියපු විදිය දිහා
d732cabb6d	ඇළ කපාගෙන යන්න
d732ef7aee	උඹ නම් ජනතා ඉල්ලීම්වලට එසැණින් සවන්දෙන නියම රජෙක්
d73325d24a	ගෞතම බුදුන්ගේ දේශයේ ද
d733901884	අරූපීයැයි හැඟීමක්ද,
d733ce6e52	නිශ්ඵල දෙයක්.
d733e1956a	නාවික හමුදාවටත් පැවරුණි
d73455c8f2	විවිධ හේතු මත
d7346e18cd	කිසිසේත්ම සිදු නොවේ.
d734aec9af	දෙතුන් දෙනෙක් හිටියනං එහෙම
d734cf6f8b	මොකද කකා අද පත්තර ගැන සදහනක් කරල තිබ්බ නිසා.
d7352b3666	දත් ගැලවුණාට පස්සේ
d73542afd0	මේක පොතකින් ගත්තු කොටසක් වෙන්ඩ ඕන
d7366dd33a	එහිදී බියට පත්වූ ළමුන් කෑ ගැසීමේදී
d73671e6c6	මහත් ඵල මහා ආනිශංස ලැබෙන අතර,
d736c7dbb7	සිංහලයන් එම ආගමට හැරවූයේත්
d736e7cab9	විදේශික කාන්තාවකගෙ පූසෙක්ට එතන හිටපු බල්ලෙක්ගෙන් කරදරයක් වෙනව
d737721f62	ඔවුන් හුරතල්කල යුතු බවක් මින් අදහස් කෙරෙන්නේ නැත.
d738143054	බුදුන් වහන්සේ හමු වූ අවස්ථාවේ දී
d73898e7dc	අන්තගාමී සිංහලීය සිනමාවේ
d738adf04c	එවැනි වෘත්තීමය රැකියාවල නිරතවන
d738e31e98	ඇය එම තත්ත්වයට පත් කළ සමාජ ක්‍රමයයි
d7391d0b07	එම අනතුරුදායක භාවය හමුවේ
d73936a846	හිටියයි කියල තමයි දන්නෙ.
d7398c8aa5	එහි කෙරෙන කලා කටයුතු ප්‍රමාණය
d73a7dbba2	තුල මෙහෙම ගති ලක්ෂණ තිබුනෙ
d73ab29dc2	මේක මේ අභ්‍යවකාශ යානයක් ගැන කෙරෙන පරීක්ෂණයක්.
d73b03b134	කවි වලට උදාහරණ පෙන්වලා
d73b112944	indian actress
d73becc2e8	මම බටහිර සංස්කෘතික හා උපායමාර්ගික
d73c2bb429	අපේ සූර්යයා වැනි වූ
d73cd557a1	සියඹලා ගෙනල්ලම නෑ.
d73cd697f1	අතිවිශාල තේරුමක් තියෙනවා.
d73d385d42	උතුම් කෙනෙක් ඇසුරු කරන්න ඕන
d73d529d73	නමුත් දැන් කියනවා
d73df71907	සියලු කෙලෙස් දුරු කළා.
d73dfb99dc	ඔරුවක හැඩය ඇති මැටි බදුන්වල
d73e2438ba	ඔබ මේ අනුව නිගමනයකට එනවා
d73e303ae6	නමුත් කවියකින් සිදු විය යුත්තේ
d73edf138b	ඉතාමත් දුක සේ තමයි
d73efdf580	උත්සාහ කරන නිසා එසේ කරන බව
d73f8383b5	දකුණේ තරුණ පරම්පරාව
d73fdf8dee	වෛද්‍යවරුන් නැවත බෙහෙත් එන්නත් ගත කළ විට
d740c14edc	මට එදා ලන්ච් අවර් එකේ
d740ef2374	එහෙම තැන්වල ඉන්නෙත් කාන්තා පුහුණුකාරියන්මයි
d7414c3698	ඔය කට කතා පතුරවන අයට
d7414c7bfd	මට සුළු තොරතුරක් සැපයීමෙන්
d7419e9972	දාලා තියෙන පෝස්ටරේ දැක්කහම
d74221ec1e	ඉපදී ඇති බව.
d74269c3f9	ඒකට පෞද්ගලිකව බැනලා එවන්න.
d74274b6bb	ඉතින් ඔහොම තමයි රට යන්නෙ
d742d54dd3	එයින් සරණක් ලැබෙනවාද?
d745483bb7	wso2 carbon
d7457793e5	මේ සභාවේ එකම කතාවක්වත් කෙරුණේ
d745bab983	සාරවත් පසක් නොමැති මෙහි
d745e705f8	නොසැලී ඉදිරියටම යනවා.
d745f4210f	නැවත උපදින්නෙ නෑ කියලා.
d7467ef456	muthu pihatu
d747227069	එවිට ඉදිරියට පැමිණි ගෝනෙක් ආපසු හැරී දුව
d7476b4486	ගෙදර කවුරුත් නැති වෙලාවක් එනකන් ඉන්න ඕනේ.
d747b42ac7	අප ඒවාට සහභාගී වන්නෙ
d747d57f17	තුති! හොඳ රස්සාවක් කරලා
d7481031e8	කර්මයන්ගේ විපාක විදීමකින් තොරව
d7482aa4bf	ඒත් එදා ඒ විවේචන වලදී
d748af97cd	මැලවී පරවී යයි.
d748c39b23	ඒකට අපි බුදුරජාණන් වහන්සේ ගැන .
d748d55324	ඔබ සුදු අශ්වයන් යෙදූ අලංකාර යානයකින්
d748d6783e	ඒත් වෙන වෙන කස්ටිය
d748d899e3	මත බොරු කියන්නේ කෙසේද?
d748db1a3a	මෙහිදී අප සැලකිල්ලට ගත යුත්තේ
d749f7634f	ඒ අයගේ පුද්ගලික තොරතුරුත් අහනවා.
d74a020c45	යළි ඉපදේවා
d74a9d4a75	වෙන නෑදෑයෙක්වත් ඇවිදින්
d74b260b8d	ඍෂිවරුන්ටද දැන් තම ශරීරය දුර්වලය
d74c019ece	ඒත් එක්කම ඔහු කිව්වා
d74c66580f	කළුබෝවිල රෝහලට ගෙන ගොස් ඇත
d74c94d5e6	ඔන්න ඊට පස්සෙ තමා
d74c94e365	එනම් පසේනදී කොසොල් රජතුමාය,
d74d245efd	අඩුපාඩු හොයන්න
d74d332148	භවයෙන් මිදීමෙන් ඇතිවන සදාකාලික සුවය කොයි ආකාර ද?
d74d40c2ca	එංගලන්තයේ රජ කෙනෙක්
d74d49bf52	තාම ඒ කොටසට යම් තරමින් හෝ
d74dc1d85d	ආපු බොහෝම හොඳ කලමනාකරුවෝ නිසා
d74e462a9b	උන්වහන්සේ කෙතරම් විමසිලිමත් වූයේ ද යනු සිතාගත හැකි ය.
d74eb5cffe	මෙම ලිපිය තුලින් කථා කරන විෂය
d74f1e9f85	සියලුම යහපත් සිතුම් පැතුම් ඉටුවන
d74f719de6	ඉගෙනීම් කරන අයට සාර්ථක ප්‍රතිඵල
d74fbe31d2	ඔය ප්‍රවෘත්තිය දැම්මේ
d7503083ce	එම රමණීය ගල්
d7506bb570	පසුගිය කාලයේදී
d7517162c3	එය සිංහලයේ රාජ වනය
d7517a2ab9	මෙම දූතයන් මගින් කෙරෙනුයේ
d751c81c0c	කරුණු සමග මම කෙසේ වෙතත්
d752654dd7	මේ දාරක ස්නේහයත්
d753077a7c	අඩේ මේ මොකක්ද
d75362f427	එක්තරා දේවතාවුන් කෙනෙකු විසින්
d7537030e9	ආයේ එයිද දන්නෙ නැහැ.
d754ccba50	ඔය කියන්නේ මෙයා ගැනද
d754dddc03	මේවා යම් මානවීය තත්ත්වයක දුක්ඛදායක පැතිකඩක් විය හැකිය.
d754ebdc83	wallpaper picture
d75534b23a	මිනිස් ලොවට පැමිණ
d755957621	එම පක්‍ෂ
d755e3f871	ඒත් මම එක ගැන
d75601de73	මෙබඳු දෝෂ සහිත පද්‍යයන්ගෙන්
d756220e6e	මෙම ඓතිහාසික ජයග්‍රහණය වැලැක්වීමට
d756469f19	මජ්ඣිම නිකාය හැම අතින්ම වැදගත් කෘතියක් බව කීමට
d758e90448	ලොව සතුටින්ම සිටින මිනිසා
d7590b5fe2	අපි හැම දෙනාට පොදු වෙච්ච යමක් තියෙනවා
d759422d13	කබලෙන් ලිපට වැටුන වගේ වැඩක්
d75954c04b	අරමුණු සැලසුම් ඉටුවන සිතේ සතුට සහනය
d759a56f7b	මේකනම් අනිවා බලන්න ඕන
d75a8a43ff	එයට හේතුව වෘත්තීය පුවත්පත්
d75aa78d39	පූර්ණය කර තිබේ
d75ad07533	හින්දි උපසිරැස ලබා දෙන්න
d75b19f70a	සංවිධානය කොළඹ 07 ආර්.ජී.
d75b25e371	බුලත් සපා තොල් රතු වූ කාන්තාවන් ගැන
d75b68e757	බොහොම වෙහෙසක් දරනවා
d75b6ab8fc	විටක පරිගණකයේ වේගය කෙරෙහි පවා මෙම තත්වය බලපානු ඇත.
d75b70c7d4	ඒත් සෝනියෝ
d75b74da82	එබැවින් බෞද්ධයන්
d75ba7ca82	බුද්ධ භාෂිතයක් බඳු
d75c75e40b	කර්මය කියන්නෙත් ඒ වගේ එකක්.
d75c88030d	නොයෙක් කරදර හිරිහැර සිදුවිය.
d75ce8af98	මන්දාකිණි ඇත්තේ අපේ සිරුරට බොහෝ ඈතින්
d75d5ac7c1	ඔහු මරා දමා
d75dbc0565	ඒකට දාන ඕනේ
d75e2b4d99	පාප මිත්‍රයා හඳුනාගත හැකි ලක්ෂණ කිහිපයක්ද වෙයි.
d75f1ea48e	පිදීම ඇදහීම මිස
d75f98f668	මහා වැඩි වෙනසක් නෑ එදා‌ සහ අද කියල
d7602185f2	එය කරන නිසා යහපතක් වේ.
d760378b01	එනම් හොඬවැල අග කොටස
d760ae5eb9	මේ විදියට අද නිමා කරන්නේ ඉමහත් සතුටකින්
d760d2a0ca	තේරුම් ගතයුතු දෙයක් ඇත
d7611dd8ea	ගුණය හරය සහ මූලික පදාර්ථ සමගයි.
d7613f4563	යනුවෙන් දේශනා කර ඇත.
d76155ac46	ඒනිසා නිවිහැනහිල්ලේ ගිහිං එන්න යන්න.
d761c293df	අපගේ සිත කය වචනය යන තුන්දොරින්
d762057729	ඔය පහල ඉන්න යකාගේ
d7620a4ac9	එයා ඒක හැම වෙලේම
d762816031	බණ පොතට අනුව සිහිකරන කොටත් සිත පිරිල යනවා.
d762b6e7f4	රජයේ හා විපක්ෂයේ පිරිස් සිටින බව
d76304fcf5	මගේ ලැපේ බැටරි බලය පිහිට වුණා
d7630f3dde	ඇය ගෙදර එන විට
d7637f012f	විවාහ ජීවිතය
d763871be4	මුළු සංසාරෙටම යම්කිසි පෝෂණ ක්‍රියාවලියක් තියෙනවා.
d763a765d9	"ටිකක් සිංදු කියන එක නවත්තන්නලු"""
d763dad68c	රැණි පෙරහර විස්තරය අනුව තහවුරු වේ.
d76447b0e6	තිරුවානා ගල්තට්ටු කඩා වැටී
d764859c90	අපි දැන් මේ මිනිස් ලෝකේ හිටියට
d764a0f57e	ඒ හේතුවෙන් වත් මේ සිත කීකරු කරගන්න
d764d9aff8	මොකද ඇය විවාහක නිසා.
d764e003ed	ඊට අමතරව රටපුරා වෙහෙර විහාර
d7650c73fa	විහිළු කරගන්නවා.
d7655b4f66	google play
d765834c76	එය සමස්ත හෙද කාර්ය මණ්ඩලයට ගත්
d7662ed014	ආයෙත් බලන්න කියලා මම ඉල්ලනවා
d7666f112d	ජීවය ඇතිවූ ආකාරය කිව හැකිද?
d767801734	ඊළඟ භවය කරා ගමන් කරයි.
d767b2f65b	අයිශ්වර්‍යා වගේ ඉංග්‍රිසි ගුරුතුමියක්
d768164d28	රහතන් වහන්සේ කියන්නේ සමාධිය සම්පූර්ණ වෙච්ච කෙනෙක්
d7682f95f3	එල එල එල ෆිල්ම් එක සින්හල
d7683fd65c	nawaliya
d768d3db20	ඒත් මේ රටේ මිනිසුන්
d769fe376a	අල්ප වූ පිරිසක් පමණක් දැන හැඳින
d76a44a76e	අද අපේ රටේ ගොඩක් අය පොත් කියවන් නෑ
d76a9a3da9	sri lankan
d76aa1e19f	එවැනි දේ සාමාන්‍ය මනුෂ්‍යයන්ට
d76abb9d0a	උසස් සමාජය ඇසුරින්
d76b48df6a	ඒකට යන්න
d76b7a0246	උත්සාහ කරනවා
d76b7f2e93	දන්ත කුමරුන් ශ්‍රද්ධාවෙන් යුතුව
d76bdcb28c	ඉවසීම අප ප්‍රගුණ කර ගත යුතුයි නේද?
d76c0b54fe	නමුත් ඒ දරුවා
d76c46cbf9	ඒත් පිරිසක් නිසා
d76c589732	ඉන් එකක් වැරදීමකි
d76c794777	ඒක ඇය
d76d349796	ඔවුන්ගෙන් දිර්ඝ කාලීනව පැටව් ලබා ගැනීමද සැක සහිතය
d76d9e57bb	මහත් සතුටක් විඳීයි.
d76dd03d07	උදේ ඉඩමට යද්දි
d76ddd5861	සිංහල යුනිකෝඩි ක්‍රමයේදී
d76e9dfba8	කවුද ඕර්ඩන් පෙට්ටිය ලබාගන්නෙ
d76eda19fe	ඔයා ඒ අස්සෙ නාලත් එක්ක
d7705b7e2f	ගස් වලට කැත්තකින් කොට
d77062bdd4	සෑම ඉරියව්වක සිටම
d771430ff1	මේක නිර්මාණයක්
d771be501b	කලිසම නොගැළපෙන බැවිනි.
d7727a3a06	උඹ තේරුං අරන් ඉන්න විදිහටම ලිමිට් පැනලා
d7728625a8	දැක ගත හැකිය.
d7728875d8	ඝාතකයො නිසා..
