0000f47c22	මහවැලි ගඟට ගොස් ආපසු එන ගමනේදී
f4007b4776	පිදුම් ලබන බවට විවාදයක් නොමැත.
f400b7fe4e	හැමෝටම බලපාන ප්‍රශ්න තියෙනව නම්
f4012c7754	එක කැමරාවකවත්
f401e4c41f	බැරි නම් අඩුම ගාණේ
f40256bf0a	මොකද ඒවා නිකම් කොට කතන්දරයක් වගේ
f402ac275a	එක් මිනිසෙකුගේ නමක් කිව හැකිද?
f402f97207	එසේ අත්අඩංගුවට ගන්නා ලද්දේ
f4034ae362	ඊට සමගාමීව ඔහු එහි රමනීයත්වය ද චිත්‍රනය කලේ ය
f403d9a5ba	පාට වර්ග සහ පින්සලය
f4055ecee4	ප්‍රබල ආඥාදායකත්වයක් සහිත ප්‍රබල දේශපාලනික ආණ්ඩුවක්.
f405648d4e	හාමුදුරුවො පිරිත් පැන් ආශිර්වාද කරලා දුන්නා.
f4067135c7	බලමුකෝ ඊලග පාර මීටත් වඩා
f4069f1407	සාම්ප්‍රදායික ආගමික ලෝක දෘෂ්ටිය වෙනුවට
f406b6de67	එවිට පාරී දම් පිරූ බවට සාක්ෂි කවරේදැයි
f4083400b2	අනේ අපේ රටේ සත්ව හිංසනයට
f408577034	මේ අනුව කාලානුරූප ගායනය හා වාදනය ද
f40863ff6b	ඒවායේ ප්‍රධාන කම්හල්වලින්
f408812410	අධිකාරවාදී රාජ්‍ය හා රාජපක්ෂ පාලනයේ මිතුරන්
f408a8dd76	ඔබ ඉහත ප්‍රකාශයෙන් අදහස් කරන්නේ
f408e1e0eb	මට නම් දැනුනේ නැහැ.
f409107a50	රණව ගම්වැසියන් එදා මෙම සංග්‍රාමය සඳහා
f409343aef	තව කතා දෙක තුනක් දාහං
f4094b3fe8	ඒත් ඒක කොහෙත්ම
f40a223972	ඒ ගැන කථා කිරීම විහිළුවකි
f40a3ebda4	තමන් නොදැනීම ඉන්ද්‍රිය සංවරය ඇතිවෙනවා
f40ad5e173	ගමනක් ලෙසින් සැකසී තිබුණි.
f40af1d3ab	විවිධ ජාතීන් ඇති
f40b06623f	දියුණු කැර ගත හැකියි.
f40c2553f2	අඳිනව නැත්තං නෑ තමයි
f40c9dfa8b	අනෙක් අතට විකිලීක්ස් කියන්නේ
f40d1ff5d9	තෝරාගැනීම ගොඩාක් උපකාරී වෙනවා.
f40d5bea1e	ඔය දෙන්නට ගොඩක් ස්තුති වෙනවා
f40d9cab56	අතික්‍රමණය කරන්නට ඔහු සමත් විය
f40e24c7f4	ගැටලූ රැසකට මුහුණදිය හැක.
f40e9fef94	ඔබට වල්බුරු නිදහසක් ඇත
f40f01c48c	හැමෝටම උදව් කළා
f40fda70c4	නිර්වාණ මාර්ගය පෙන්වා
f4105ee628	ඔහුගේ යටි අරමුණ මනාව පැහැදිලිවේ.
f4109b6514	මෙම ගැටලුව සමහර ෆිල්ම් ඩවුන්ලොඩ් කරන්න ගියාම මතු වෙනවා සමහරකට නැහැ.
f410ee4076	මෙ කෑලේ මංමුලා වැල් තියෙනව කියල කියනව.
f41198eb31	මේ එක් එක් ගුණයක් පිළිබඳ
f411c8e4de	මා ලද මහත් භාග්‍යක් කොට සලකමි
f411e58d85	අනික අපි ප්‍රවෘත්ති
f412081290	ස්තුතියි දිදුල
f4124c4df1	වන්නේ අහිමි වීමේ හේතුව
f4127678ab	ඉතා වැදගත් ප්‍රබල සිදුවීමකි.
f412bcf4aa	කැපවීමෙන් කටයුතු කරන ස්වල්පයක් ද
f412d987fd	ඒවා ගැන
f412e0eb04	ඇත්තටම එය පොලිස් බලකායක්
f41312e2fe	භාවිත කළහ.
f413c82b32	මේ හැම කෙනෙක්ගේම ශක්තිය නිසා.
f41407d8f5	බුදුන් වහන්සේ සමවත් සුවයෙන් වැඩ සිටි භූමියකි.
f4144611ca	නමුත් එය කෙලින්ම
f4146686e3	අථර්ව වේදයේ සඳහන්ය.
f41486529c	ඇය තෙවැනි දරු ප්‍රසූතිය
f414af1bc2	බවද කියනු ලැබේ.
f414b4f8dc	ආවාට කමක් නෑ
f414c74564	එයට පිළිතුරු දෙන
f41557d51b	බෞද්ධ සාහිත්‍යයෙහි සඳහන් වන අන්දමට
f4163732ba	සිතට වසඟ වූ ලෝකයට
f416bf3d1f	ලොකුම ලොකු කේක් ගෙඩියක්.
f41712bfb5	ඔය වැදගත්
f4179dca58	පිළිබඳව ද අදහස් දක්වා තිබේ
f4186537ea	මෙතෙකැයි කියා කිව නොහැකි තරම් ය.
f418f592a9	කවුරු කවුරුත් උනන්දු විය යුතුය.
f41963e857	කරගෙන යන්න කියලයි.
f419b03188	අංකදරන දුම්රිය බිම් ගෙය
f41a2acbe1	අද කාලෙ
f41a845d4c	පුද්ගලික රෝහල්වලත්
f41b190bb9	බෞද්ධ දෙවිවරුන්
f41b71db66	මේ පිළිබඳ ව උපදෙස් ලබා ගැනීම සඳහා
f41b7da97a	අන්දුන් කුන්දුන් විය
f41bc155c2	ආදරය සහ විවාහය මෙම මස තුළ ඔබගේ ආදර සබඳතා
f41c0b5540	හතරක් රජමහා විහාර මළුවේ
f41c3e2d34	ශ්‍රී ලංකා වරාය අධිකාරිය සතු වෙනවා
f41c79572b	රක්‍ෂිත බන්ධනාගාර ගතකර සිටි සභාපතිවරයා
f41c9aca3e	නොදැනුම නිසා පරිවර්තනය කලාම
f41c9c4ff2	මේ ගෝ කාට්ස් කියන රේසින් කාර් හදන්නෙ.
f41ceb4f63	එහෙම බලන්නේ නැති කට්ටියට කියන්නේ
f41d3da166	නොයෙකුත් දේ සොයන අතර
f41d3effe8	අගොස්තුවැනිදා පස්වරුවේ නාසා ආයතනය නිවේදනය කර සිටියේ
f41d7a60a1	වෙනත් කලෙක කොහොම වේවිද?
f41d968758	රටේ සිදුවන දේ ගැන
f41df6d4b0	අනික මූ මේ කියන ඒවා
f41df8c137	පිටතින් සිට පහරදීමක් නොවේ
f41e0707a0	දවල්ට උයන්න පටන්ගන්නව
f41e28e20e	දොස්තරලා ගැන නම් කියල වැඩක් නෑ.
f41e92753f	අපි බොහෝම ගෞරවයෙන් කතා කරන
f41e9ff19b	ඔය කියන පරමාණු එහෙම
f41f45ee6b	ඕනෑම ප්‍රශ්නයක් එයාට කියන්න කියාය.
f41f7ba275	බලාගන්න මව්පිය කැපකරු ක්‍රමයක්
f421067440	ඉහත සඳහන් කළ අයථා ක්‍රියාවල යෙදේ.
f4215f7dbe	බොහෝ සතුටු වුනා.
f42203182a	තෘෂ්ණාව දුරුකර ගැනීමයි.
f42215619a	මාක්ස්වාදී සාහිත්‍යයේ මෙසේ දැක්වේ
f4222c7ec3	ඔහුගේ කැපවීම ගැන නොකියා කොහොමද?
f422c5fd0b	ඒක ලොකු උදව්වක් වෙනවා
f422d33595	green brown
f422f98d37	මාරු වී ඇති අයුරුයි.
f42333b49b	ගොයම් කරල් ගන්නවා වගේ.
f4234e12b4	එදා ඒ බැට කාපු අපේ දරුවන්ට.
f4239e7ed5	සර්ප විෂ වලට
f424309625	කිරිපිටි බවට පත්කරනවා.
f4243f1b79	මීළඟ පරපුර අරමුණු කරගෙනය.
f424454b3b	වගකීමකින් තොර ව
f4249a324b	එවැනි රෝග සුව කිරීම සඳහා
f424db8ee3	බුදුරජාණන් වහන්සේ දේශනා කරනවා
f424ea9fc5	වාසය කළ නොහැකිය.
f4256d56bc	සමහර ආධුනික ගුවන් විදුලි ශිල්පීන් දායක වී ඇත
f426e18486	ණයගන්නේ හුඟක් කාල ටිකක් සංවර්ධනය කරන්න.
f42798d768	තම දැනුම ප්‍රායෝගිකව යෙදිය යුතුවන අතර
f4285729f7	බුද්ධ දේශනාවල ඇතුළත් දැ යි
f4285bd7c1	එම නිසා එය කිසි දිනක
f4289a99b4	රිවිසරසි පිටු අතරේ තබන්න කල්පනා කළේ
f428af01b5	මනමේ කුමරුන්ගේ හා රාජගුරු දියණියගේ පෙම් පුවත
f428d610b7	සැබෑ තත්වය නම් දැනටත්
f4292f11bc	බුදුරදුන්ගේ සත්‍යවාදී බවත්,
f4294589a6	යම් කෙනෙක් සක්විති රජවෙලා උපන්නොත්
f42945c52b	යෝනිසෝමනසිකාරය පවත්වාගෙන
f4299d5e24	එම තත්ත්වාවබෝධය මගින්
f429aa923b	අංග රැසක්
f429e41639	වයස අවුරුදු පහළොවෙන් පසු දරුවන් වෙන් ව ජීවත්විය යුතුයි කියා.
f42a6cd252	අපි ඉක්මනට සාරිය කපලා
f42ad37ea3	windows xp service pack 3 download
f42aeb044e	තීරණයන් වෙත එළඹීමේ දී
f42aef4700	එහෙම තත්ත්වයක් තුළ
f42bb83075	එසේ ලැව් ගින්නක් සේ වචන පත්තු කිරීම
f42bdf364a	එබැවින් රාජකීයයන් හා නිලධාරීන්ද
f42c0567d7	photobucket
f42c185c20	අකුරු කියන දේවල් කිසියම් සංකේත සමූහයක් පමණයි
f42c538956	ආගමීක සහජීවනයට මේ තීරණය
f42c86c268	නමුත් මට ඔයා එක්ක
f42d6c6c89	එය සාර්ථකව සිදුකර ගැනීමට
f42d87f4e3	පිළිම ගේ තුළ
f42deac162	හිතින් කොල්ලෙක් උනත්
f42e50fc39	ඒ බෑග් එක අනිවාර්යෙන්
f42e9cd969	වහා මැන දෙයි.
f42f1f0293	බුදු දහමට අනුව
f42f4dacf8	අද ද ලොව පුරා රාජ්‍යවලද දැකිය හැකිය
f42fdf437d	ජන ජීවිතයෙන් ඈත් නොකිරීම
f430690089	යම් කෙනෙක් සර්පයෙකුගේ හිස ළඟින් අල්ලා ගතහොත්
f4316bf4e6	රජය විසින් විශාල කාර්යභාරයක් ඉටුකළ යුතුය.
f431d062d9	කිසියම් විශේෂ සිදුවීමක් ලෙස හැඳින්විය හැකියි
f43219cc4d	අර්ජුනට ශ්‍රී රාමා මහේෂ් ඍෂිතුමා නම්
f4321b1283	ඔතන නෙමෙයි කියලා මට හිතෙනෙවා
f4322de297	තරබාරු සිරුරු ඇති අය හා මිත්‍රකම් පැවැත්වීම
f432b07087	උත්සාහයක් ගන්නෙත් නෑ.
f4338529e7	අපිට බය සිතුනද
f433be7b5f	ජනතාවට නිදහසේ ගතකිරීමට
f4340060c0	මේ නිර්මාණය වන තොරණ
f4344d3cbc	කල්පනා කළ දෙයක් තමයි යුද්ධය හැර
f434ad8de4	එවැනි පසුබිමක් ඇති කරන ප්‍රතිපත්තියක
f434f48834	එහෙම උනානම් මම මොන දේ කරලා හරි
f4354a25a3	පෞරාණික ස්වරූපයෙන් අත්‍යාලංකාර කොට තිබිණ
f4358d9e1c	බුදුරජාණන් වහන්සේට සැළ කර සිටියහ.
f435d89cb3	සාරංග මෙන්ඩිස්ගේ අධ්‍යක්ෂණයෙන්
f435f335d2	මෙකී තෙරුන් වහන්සේ පිළිබඳ වූ
f4360ef8a6	අපි එක්ක ඉන්න
f436e21245	එක් පැතිකඩක් චිත්‍රණය කරන්නකි.
f439b71530	එක පැත්තකින් මුතු ඇට වලින් හදපු මාළිගාවක්
f439dc8507	මේ භගු ස්වාමින් වහන්සේත්
f439f18ec3	වාසි සලසා ගත හැකි බව
f43a9e3b93	එනම් ක්‍රියාව නැති තැන
f43aaa5619	‘ලු’ යන්න දාන්නම ඕනැ.
f43acf1e26	මේව ගැන දැනගන්න ලැබීම ගැන සතුටුයි
f43af621ca	අපිත් කොමෙන්ට් කොටනවා වැඩ පාඩු උනත්.
f43beda676	කොළඹ නගරයේ වීදි වල
f43cae0909	ජාතියේ නාමයෙන්
f43d023e61	වස්තූ තණ්හාවෙන් පිරී ඉතිරී ගිය බමුණෝ
f43d5b5302	යම්කිසි ආර්ථික දියුණුවක් ඇද්ද
f43d8db552	වාග්ප්‍රනිධාන ආරම්භ කළේ ය.
f43e341bac	ඒවා ඉංග්‍රීසි පාඨ ග්‍රන්ථ විචාරය සඳහා
f43e69f3b3	සුවිශේෂ වූ හිටි පිළිමයකි.
f4407a17e7	බැලූ බැල්මට මනමේ දේශපාලනික නාට්‍යයක් නොවේ.
f440af4a48	මෙයා කලානම් නානවා
f441db4090	බෝධි පූජා කිරීම හා
f44230000a	දේශපාලනික මිනිසුන් සිර කර තැබීම
f44290d242	මේ ශ්‍රී ලංකා භූමිය කියලා.
f442a79ac6	මඟ හැර යාම
f442c914d3	අයවැය ‍ලේඛනය පමණක් අරගෙන
f442cfc0ed	එහෙත් ඔවුන් එම ක්‍රියාමාර්ග
f442daafc2	lanka truth
f44353fa6c	මෙච්චර කාලයක් හිටියේ සත් ගුණවත් උපාසකයෙක් වගේ.
f443b1e265	දැයින් වැසී පැවති යථාර්ථය යි
f4446b562d	ඔබවෙත ගෙන ඒම
f444fb4978	ඒත් අර බෙදීම මතක් වෙනකොට
f445674847	එනිසා නූතන සමාජය තුළ
f445790ba8	කියන හීනෙට කෙලවෙනවනෙ.
f445965201	කෙලෙස් දුරු කිරීමට, කෙලෙස් නැසීමට මිස
f445ad9c1d	ඒකේ සද්දේ ඇහෙන්නේ නැත්තේ
f446566bf7	බැංකුවෙන් මාස් පතා ණයට දුන්නු සල්ලි
f446b272db	ඊට අනුගත වන නිසාත් ය.
f446f03505	ඒ වගේම කලා ක්‍ෂේත්‍රයෙන්
f4476b8c0a	අපි අපි එකතුවෙලා.
f4477b94b5	කෝටි හතළිහක් වූ පිරිසක් මරණයට පත්වීම.
f447c65261	භයංකාර පෙනුමක් ගෙන දෙන මුහුණකිනි.
f448cc2d59	මෙම කෘතියේ
f448e82271	මගේ ක්‍රිකට් නවත්තන්න කලින්
f448fca63b	එම නිසා භික්‍ෂූන් වහන්සේ වශයෙන්
f44906edf6	ඔහු එකපාරටම
f44918e4dd	පිරිමින්ට දීල තියෙනවා
f4493f550c	අපි කවුරුත් කවදාහෝ මැරෙනවා
f44946b3df	ඔබ ඔබේ ලොවේ!
f449ca46ec	එය දෙව් විමන් ලැබ
f449cfb8f4	දෙවියන්ට හො වෙනත් බලවේගයකට කියා හදන්න පුලුවන්
f44a24ef4c	sonic
f44a9f6263	අහෝ මල් පුදා කන්න දිය යුතු
f44b099830	lanka sri
f44b0cb378	මෙම අයහපත් චර්යාව විමසීමකින් තොරව
f44bdccd7e	මාධ්‍ය ප්‍රධානීන් හමුවේදී
f44beaee72	රජයේ අතුරු කොටස් විදියට
f44c7ca836	වැඩක් නෑ මේ විදිහට
f44ca8f740	උන් කොහේද
f44cf97f35	මගේ ජීවිතය අද බොහොම යහපත් විදිහට ගත කෙරුණා.
f44d2851cc	කරන කටයුතු ගැන හිතුවොත්.
f44d363c25	ඔවුන්ගේ ආරක්ෂක තත්වයේ ඇති අඩු පාඩු කම්
f44d8caf78	එල කොල්ලෙක්නෙ
f44da8fef7	තේරුම් ගනින්.
f44dd1f231	සිංහල රට නැති උනාට පස්සේ
f44e0a6819	මේවගෙ වැදගත් දේයක් නොබලන දැස
f44e54d31f	භාවනා සම්බන්ධයෙන්
f44ed2ffad	හරියට ගමක සිද්ධියක්
f44ed97216	ඊට කදිම නිදසුනක් පසුගිය වසරේ පළව ඇත
f44f236c50	යුද්ධය අවසන් වීමත් සමග
f44f72d8ee	හැඳි මිටේ දිග ගැන මතක් වුණා
f44ff8a003	මීට කලින් සෞඛ්‍ය වෛද්‍ය කාර්යාලයේ හිටපු නිලධාරීන්
f4502419a8	කට්ටිය ඕසෙට මේ පැත්තෙ කරක්ගහන නිසා
f4506602ac	ඒක නිසා පළමුවෙන්ම අපි යන්න ඕනේ පුත්තලමට.
f450c3ff6a	සියලුම දැනුමෙන් හා හැකියාවෙන් පිරිපුන් අයකු වීම
f450df6db3	හිතෙන්නේ නෑ.
f450e9056b	උඹ කියන්නේ මහින්ද ඒකාධිපතියෙක් කියලා නේද?
f45167ff11	ගොඩක් කල් ඉදල බලන්න හිටපු
f45204ee60	වැළඳගැනීමට සුදුසු
f4521c8783	ඔය කාරණාව මතක් උනත්
f452bd8215	ගීතයක් ගැන ඕනෙම කෙනෙකුට
f452f583dc	ගෙයක් හදාගන්න
f4539d656a	හාහ් හාහ් හාහ් හාහ්
f4542eaaa7	එහෙම වැඩ
f454a1e5e8	එයා ළඟට ගියේ කියලා
f454ddb641	පෞරාණික චාරිත්‍ර පුද සිරිත්
f455183f9e	අන්තර්ජාලය පාවිච්චි කලේ අධ්‍යාපනය සඳහා විතරමයි
f45526dfed	ඔන්න ඊලඟ පෝස්ට් එක එනකම් නම්
f4557a12a7	අපිත් වැඩිවිය පත්වුනාම තමයි
f455c3d0f7	ඒ වැව බලා ගත්තු මුරකාරයා
f456892b30	ඒ හැම එකකම අනිත් පැත්ත.
f456bcb122	හොඳ අරමුණකින් ගත්තු වැරදි පියවරක් හැටියට
f4572bb20d	හැබැයි නිතරම රඟපාන්න ලැබෙයිද
f4575e2a87	එහෙම කියලා හිතෙන්නේ අන්න ඒ වගේ වෙලාවටයි.
f4576f9750	වෙන මොන සාක්කිද ඕව හොඳටම ඇති.
f457b167ae	මැරබලයෙන් ධන බලයෙන් රජවෙන
f458f7c4cc	ඒත් රෙජිනෝල්ඩ්
f45906cdac	ඒත් මහා පුරුෂ ලක්ෂණ
f459710326	විතරක් මතකයේ තියාගන්න.
f459a6c16c	හැකි නම් එකී ප්‍රශ්නයට පිළිතුරු දුන් ලෙසම
f459c9d384	මේවා සමාජයේ තියෙන කුහකකම් වලින් ඇතිකරන දුර්වලකම්.
f459cd5f23	පිට.වෙඩිවර්ධනගේ නවකතාව මගින්
f45aa3ed56	ඒත් අපේ සිල් ඇත්තන්ට නම්
f45b07295f	සමාව ඉල්ලමි.
f45b3d89a7	ඉතින් ඔය මෝඩ දෙමව්පියන්ට බැරිද
f45b488eb5	එවැනිම පැරණි වෙනත් කඩදාසියක
f45b7da381	උසාවියට ඉදිරිපත් කරන්න බලාපොරොත්තු වෙනවා
f45b8a7fa5	ඒවා පොදු ජනතාව වෙනුවෙන් යෙදවෙනවා.
f45c17f381	රුපියල්–අතර දඩයක් නියම කළ හැකිය
f45d2b833e	වැදගත් මෙහෙවරක් ඉටුකරන ලදී.
f45d366256	අඩුම තරමේ පුද්ගලික බස්වල සේවකයන් බඳවා ගැනීමේදි
f45d5da25e	ණයක් ලෙස මේ මුදල් ලබා ගන්නවා
f45dca9373	සමහර උන් කෙල්ලෙක් නම් අපහසුතාවයට පත් කරනවා
f45e1f60df	victoria secret 2011
f45e2faefb	වර්තමාන පරපුර දන්නා නැති තරම්ය
f45e5ca580	අන්තිමට අර ටැබ්ලට් ජාතිය හැදින්වුවෙ ටැබ්ලට් කියල.
f45e9e591b	එම ප්‍රමාණය තව දෙගුණයකින් වැඩි වේ
f45ed568fb	මමත් ඒක හිතා ගත්තා
f45f0e79b7	එක්සත් ජාතික පක්ෂය ජනතා විමුක්ති පෙරමුණ ඒ පුද්ගලයව අතහැරියා
f460098a96	එතකොට මේ මහා පින්වතා
f4604d50a1	අමුසොහොනෙදි ඒ මරණයට පත්වෙච්ච
f461200770	එයින් අදහස් කරන්නේ නිර්මාණකරුවා
f4619b856a	සීතල පොළවම සිරි යහනක් වේවා කියායි
f461a025d6	අන්න ඒකෙ දෙවෙනි කොටස තමයි
f46214eecc	අලුතෙන් බිහිවූසුපර්ස්ටාර්ස් ගායිකාවක්ද පෑමිණ සිටියේලු
f462851577	සංශොධනයක් ගෙනල්ලා.
f462912b28	තියෙන්නෙ කියල.
f462af8945	උපතින් ලද ස්ත්‍රී හෝ පුරුෂ භාවය පසෙක ලා
f462d36cf7	එය ඉන්ද්‍රජාලික යථාර්ථවාදය නැතිනම්
f462e1e2e0	නමුත් ඇය පොහොසත් බව දන්නේ නෑ
f462f01ef9	අධික වැඩ රාජකාරි නිසා
f462f47d4e	සිත භාවනාවේ නොයොදවති.
f462f9832c	ඊට පස්සෙ ගෑණු ටික කැලේ
f46316890a	ඔය පිංවතුන්ට
f463531616	sarath fonseka
f4638301e3	නූලකින් වෙලා එළ කිරෙන් තම්බා
f463a5d7cd	එහේ උන්නු අලි පැංචලාට
f463f769e1	ඇත්තටම කිව්වොත් ඒක වටේ පිටේ අයට පේන්න කරපු ප්‍රදර්ශනාත්මක ආදරයක්.
f464f394c1	මේ උත්සවය මුළුමනින්ම සාර්ථක විය.
f4653f1737	මොකක්ද ඇති වැඩේ?
f466258cf3	ඇය පුතුගේ ප්‍රශ්න පත්‍රයට එබී බැලීමට සිතුවාය.
f4662dfff8	පා සෝදා ගැනීමට භාවිත කළ
f466bdb55a	අඩෝ ගලයා
f466d4d15f	ඔවුන් පදිංචි ප්‍රදේශවල නැති නිසා
f467234513	එක්තරා දිග කතන්දරයක් සැඟවී ඇත.
f46747463f	කලින් කොටස මතක් කරගම්මු එහෙනම්.
f467f07519	එහිදී විවේකය
f468928ca7	මෙම ඉසව්වේ පවතින ස්වභාවය
f46950e57f	වරදින එකක් නෑ.
f469955eeb	එය තිබ්බතයට හඳුන්වා දෙනු ලැබුණේ
f469b99f67	ඔහු නිර්මාණය කළ වැදි ගී මිහිර ප්‍රසංගය
f469ca58d1	අන්න ඒකට බාධාවක් විදිහට
f46a8d99e6	ශ්‍රේෂ්ඨ ප්‍රජාතන්ත්‍රවාදී ලක්ෂණයකි.
f46ad9df51	ඒත් එතකොට තවත් සහෝදර නිලධාරීන් පිරිසක්
